8,Nicholas Runolfsdottir V,True,explicabo consectetur debitis voluptates quas quae culpa rerum non
8,Nicholas Runolfsdottir V,True,maiores accusantium architecto necessitatibus reiciendis ea aut
8,Nicholas Runolfsdottir V,False,eum non recusandae cupiditate animi
8,Nicholas Runolfsdottir V,False,ut eum exercitationem sint
8,Nicholas Runolfsdottir V,False,beatae qui ullam incidunt voluptatem non nisi aliquam
8,Nicholas Runolfsdottir V,True,molestiae suscipit ratione nihil odio libero impedit vero totam
8,Nicholas Runolfsdottir V,True,eum itaque quod reprehenderit et facilis dolor autem ut
8,Nicholas Runolfsdottir V,False,esse quas et quo quasi exercitationem
8,Nicholas Runolfsdottir V,False,animi voluptas quod perferendis est
8,Nicholas Runolfsdottir V,False,eos amet tempore laudantium fugit a
8,Nicholas Runolfsdottir V,True,accusamus adipisci dicta qui quo ea explicabo sed vero
8,Nicholas Runolfsdottir V,False,odit eligendi recusandae doloremque cumque non
8,Nicholas Runolfsdottir V,False,ea aperiam consequatur qui repellat eos
8,Nicholas Runolfsdottir V,True,rerum non ex sapiente
8,Nicholas Runolfsdottir V,True,voluptatem nobis consequatur et assumenda magnam
8,Nicholas Runolfsdottir V,True,nam quia quia nulla repellat assumenda quibusdam sit nobis
8,Nicholas Runolfsdottir V,True,dolorem veniam quisquam deserunt repellendus
8,Nicholas Runolfsdottir V,True,debitis vitae delectus et harum accusamus aut deleniti a
8,Nicholas Runolfsdottir V,True,debitis adipisci quibusdam aliquam sed dolore ea praesentium nobis
8,Nicholas Runolfsdottir V,False,et praesentium aliquam est
